{
  "$schema": "../../contracts/comparison-run-config.schema.json",
  "mode": "BACKTEST_COMPARISON",
  "suite_file": "../suites/nifty_intraday_baseline_comparison_v1.json",
  "suite_id": "nifty_intraday_baseline_comparison_v1",
  "data": {
    "source_id": "qualified_historical_equity_1m",
    "daily_feature_source_id": "qualified_historical_equity_1d",
    "timezone": "Asia/Kolkata",
    "date_start": "2020-03-09",
    "date_end": "2024-06-10",
    "universe_mode": "point_in_time_index_membership",
    "symbols": [],
    "point_in_time_index_code": "NIFTY50",
    "require_qualified_data": true,
    "data_snapshot_mode": "freeze_at_run_start",
    "named_windows": [
      {
        "name": "covid_crash",
        "start": "2020-03-09",
        "end": "2020-03-31"
      },
      {
        "name": "ukraine_invasion",
        "start": "2022-02-21",
        "end": "2022-03-04"
      },
      {
        "name": "lok_sabha_result",
        "start": "2024-05-27",
        "end": "2024-06-10"
      }
    ]
  },
  "portfolio": {
    "comparison_capital_mode": "isolated_equal_capital",
    "initial_cash_per_strategy_inr": 1000000,
    "ticket_size_inr": 200000,
    "max_open_positions_per_strategy": 5,
    "reserve_entry_costs": true,
    "reject_when_cash_insufficient": true
  },
  "execution": {
    "workers": 4,
    "days_per_shard": 20,
    "symbols_per_shard": 5,
    "checkpoint_every_bars": 25000,
    "heartbeat_seconds": 10,
    "resume_policy": "reuse_verified_completed_shards",
    "path_policy": "stop_first",
    "random_seed": 0
  },
  "outputs": {
    "artifact_root": "artifacts/backtest-comparisons",
    "persist_to_postgres": true,
    "write_csv": true,
    "write_json": true,
    "write_parquet": true,
    "build_html_report": true,
    "build_pdiagram_snapshots": true,
    "build_comparison_report": true
  },
  "publication": {
    "auto_publish": false,
    "require_validation_pass": true,
    "require_compatibility_hash_match": true,
    "require_independent_verification_for_full_run": true
  },
  "requested_by": "operator",
  "run_name": "baseline_suite_named_stress_windows"
}